{
  "schema_version": 1,
  "decision_id": "dddddddd-dddd-4ddd-8ddd-dddddddddddd",
  "status": "accepted",
  "decision": "decline",
  "invitation": {
    "schema_version": 1,
    "invitation_id": "bbbbbbbb-bbbb-4bbb-8bbb-bbbbbbbbbbbb",
    "incident_id": "66666666-6666-4666-8666-666666666666",
    "sequence": 1,
    "responder": {
      "schema_version": 1,
      "responder_id": "11111111-1111-4111-8111-111111111111",
      "display_name": "Maya R.",
      "role": "venue_staff",
      "skills": ["first_aid", "cpr", "aed"],
      "rank": 1,
      "distance_band": "within_100_m",
      "available": true,
      "location_updated_at": "2026-07-18T14:32:20Z"
    },
    "status": "declined",
    "invited_at": "2026-07-18T14:32:23Z",
    "responded_at": "2026-07-18T14:32:25Z",
    "decision_id": "dddddddd-dddd-4ddd-8ddd-dddddddddddd"
  },
  "transition": null,
  "accepted_dispatch": null,
  "server_received_at": "2026-07-18T14:32:26Z"
}
